<?xml version="1.0" encoding="UTF-8" standalone="no"?>
<!--
   New Perspectives on XML
   Tutorial 4
   Tutorial case

   PSAT mathematics course student list

   Filename:         students.xml
   Supporting Files: studentsfc.xsd, studentsrd.xsd, studentsvb.xsd
-->

<students xmlns:xsi="http://www.w3.org/2001/XMLSchema"
xsi:noNamespaceSchemaLocation="studentsvb.xsd">
   
   <student stuID="I8900-041" courseID="PSAT-080-5">
      <lastName>Garcia</lastName>
      <firstName>Georgianna</firstName>
      <examDate>2017-10-17</examDate>
      <pretest level="M">55</pretest>
      <score>51</score>
   </student>

   <student stuID="I7711-121" courseID="PSAT-080-5">
      <lastName>Smith</lastName>
      <firstName>Ryan</firstName>
      <examDate>2017-10-17</examDate>
      <pretest level="L">25</pretest>
   </student>

   <student stuID="I7012-891" courseID="PSAT-080-5">
      <lastName>Zheng</lastName>
      <firstName>Paddy</firstName>
      <examDate>2017-10-17</examDate>
      <pretest level="H">65</pretest>
   </student>

   <student stuID="I8053-891" courseID="PSAT-080-5">
      <lastName>Steinke</lastName>
      <firstName>Devon</firstName>
      <examDate>2017-10-22</examDate>
      <pretest level="M">51</pretest>
   </student>

   <student stuID="I8154-741" courseID="PSAT-080-5">
      <lastName>Browne</lastName>
      <firstName>Brenda</firstName>
      <examDate>2017-10-22</examDate>
      <pretest level="L">30</pretest>
   </student>

</students>
